Campus,Year,Session,Subject,Course,Detail,Section,Title,Professor,Reported,Avg,Median,Percentile (25),Percentile (75),High,Low,<50,50-54,55-59,60-63,64-67,68-71,72-75,76-79,80-84,85-89,90-100
UBCV,2024,S,FRST,150,,921,Scholarly Writing and Argumentation in Forestry,Duff Roberts,25,82.1,84.0,82.0,86.0,90,63,0,0,0,1,1,0,1,3,7,11,1
UBCV,2024,S,FRST,307,,921,Biotic Disturbances,Rolando Descalzo,36,90.8,92.0,87.0,94.0,96,80,0,0,0,0,0,0,0,0,4,7,25
UBCV,2024,S,FRST,449,C,922,Directed Studies in Forestry,,14,95.8,98.0,95.0,98.75,100,76,0,0,0,0,0,0,0,1,0,0,13
UBCV,2024,S,FRST,456,,921,The Role of Natural and Planted Forests in the Global Bioeconomy,Andres Varhola Troya,13,87.2,87.0,85.0,91.0,100,68,0,0,0,0,0,1,0,0,2,4,6
UBCV,2024,S,FRST,507,C,921,Topics in Forest Science,,13,91.8,92.0,91.0,93.0,98,83,0,0,0,0,0,0,0,0,1,1,11
UBCV,2024,S,FRST,555,,101,Fundamentals of Sustainable Forest Land Management,,22,89.2,88.0,86.0,92.75,97,82,0,0,0,0,0,0,0,0,1,13,8
