Campus,Year,Session,Subject,Course,Detail,Section,Title,Professor,Reported,Avg,Median,Percentile (25),Percentile (75),High,Low,<50,50-54,55-59,60-63,64-67,68-71,72-75,76-79,80-84,85-89,90-100
UBCV,2024,S,COMR,329,,921,Principles of Organizational Behaviour,Wayne Rawcliffe,39,76.0,76.0,74.0,79.0,86,46,1,0,0,0,0,2,10,16,9,1,0
UBCV,2024,S,COMR,398,,921,Introduction to Business Processes and Operations,Mahesh Nagarajan,42,76.6,80.0,71.0,84.0,95,50,0,2,2,2,2,4,6,2,12,5,5
UBCV,2024,S,COMR,457,,921,Fundamentals of Financial Accounting,Akash Rattan,46,80.4,81.5,76.25,86.75,99,52,0,2,1,1,0,4,3,6,13,7,9
UBCV,2024,S,COMR,465,,971,Marketing Management,,24,73.7,74.0,70.0,77.25,85,61,0,0,0,2,2,6,3,7,2,2,0
UBCV,2024,S,COMR,473,,971,Business Finance,Caren Lombard,31,78.5,78.0,69.0,86.5,97,50,0,2,0,1,4,2,5,2,3,5,7
UBCV,2024,S,COMR,493,,971,Strategic Management in Business,Adam Pankratz,16,78.3,78.0,76.75,80.0,83,74,0,0,0,0,0,0,2,7,7,0,0
