Campus,Year,Session,Subject,Course,Detail,Section,Title,Professor,Reported,Avg,Median,Percentile (25),Percentile (75),High,Low,<50,50-54,55-59,60-63,64-67,68-71,72-75,76-79,80-84,85-89,90-100
UBCV,2024,S,PLAN,448,A,001,Special Topics in Urban Studies - FIELD STUDY ABROAD,Su-Jan Yeo,12,93.3,93.5,92.5,95.0,96,90,0,0,0,0,0,0,0,0,0,0,12
UBCV,2024,S,PLAN,516,,001,Planning for Community Economic Development,William Trousdale,12,93.2,93.0,91.75,94.75,98,88,0,0,0,0,0,0,0,0,0,1,11
UBCV,2024,S,PLAN,543,,001,Indigenous Community Planning Practicum,,6,88.2,90.5,85.75,93.0,96,74,0,0,0,0,0,0,1,0,0,2,3
UBCV,2024,S,PLAN,550,A,003,Directed Studies,,8,95.5,100.0,89.75,100.0,100,85,0,0,0,0,0,0,0,0,0,2,6
UBCV,2024,S,PLAN,583,,001,Housing and Community Planning Policy,Michael Gordon,13,90.5,90.0,86.0,95.0,97,83,0,0,0,0,0,0,0,0,1,5,7
