Campus,Year,Session,Subject,Course,Detail,Section,Title,Professor,Reported,Avg,Median,Percentile (25),Percentile (75),High,Low,<50,50-54,55-59,60-63,64-67,68-71,72-75,76-79,80-84,85-89,90-100
UBCV,2024,S,STAT,200,,921,Elementary Statistics for Applications,Hoi Yin Eugenia Yu,115,76.1,78.0,68.5,84.5,98,18,2,1,5,7,13,5,16,14,23,20,9
UBCV,2024,S,STAT,201,,202,Statistical Inference for Data Science,Melissa Lee,91,75.7,78.0,69.0,84.5,99,29,3,3,6,2,6,8,10,11,19,14,9
UBCV,2024,S,STAT,251,,921,Elementary Statistics,Lasantha Premarathna Wijendra Acharige,188,80.5,81.5,74.0,88.0,99,24,2,3,2,2,8,11,27,21,39,37,36
UBCV,2024,S,STAT,301,,103,Statistical Modelling for Data Science,Rodolfo Lourenzutti,69,77.9,80.0,70.0,86.0,96,34,1,2,2,2,5,8,2,8,13,14,12
UBCV,2024,S,STAT,302,,921,Introduction to Probability,Xiaoting Li,119,77.9,83.0,76.5,90.0,100,0,10,2,1,4,1,4,4,16,23,22,32
UBCV,2024,S,STAT,305,,001,Introduction to Statistical Inference,Vivian Meng,37,74.5,76.0,68.0,82.0,100,24,2,2,0,2,2,5,5,4,7,2,6
UBCV,2024,S,STAT,306,,201,Finding Relationships in Data,Bruce Dunham,30,78.0,81.0,73.5,85.75,94,51,0,1,2,2,1,1,2,1,10,7,3
