Campus,Year,Session,Subject,Course,Detail,Section,Title,Professor,Enrolled,Avg,Std dev,High,Low,<50,50-54,55-59,60-63,64-67,68-71,72-75,76-79,80-84,85-89,90-100
UBCV,2018,W,GRSJ,101,,001,Introduction to Social Justice,Kim Snowden;Se Jin Um,76,75.986842105,12.993837946,91.0,19.0,,,,,,8,5,19,19,14,
UBCV,2018,W,GRSJ,101,,002,Introduction to Social Justice,Beth Stewart;Jessi Taylor;Tessa Macintyre;Tessa Mae Macintyre,74,78.851351351,7.7347860960000006,94.0,59.0,,,,,5,,11,15,17,14,5
UBCV,2018,W,GRSJ,101,,202,Introduction to Social Justice,Amilcar Packer;Jessi Taylor,70,81.542857143,13.888464314,95.0,5.0,,,,,5,,5,9,9,13,22
UBCV,2018,W,GRSJ,101,,227,Introduction to Social Justice,Lori Macintosh;Savoy Williams,85,81.670588235,5.405879153,93.0,64.0,,,,,,,6,17,32,22,
UBCV,2018,W,GRSJ,102,,001,Global Issues in Social Justice,Evangelia Chatzivasileiou;Leonora Angeles;Wajiha Mehdi,74,79.62162162199999,15.691986177999999,99.0,0.0,,,,,,7,7,8,10,8,23
UBCV,2018,W,GRSJ,102,,002,Global Issues in Social Justice,John Paul Catungal;Minelle Mahtani;Romina Tantalean Castaneda,66,81.515151515,14.889585854000002,93.0,10.0,,,,,,,,7,21,24,9
UBCV,2018,W,GRSJ,200,,001,Gender and Environmental Justice,Mayuri Sengupta,32,72.84375,15.811611444,89.0,0.0,,,,,,7,,,6,6,
UBCV,2018,W,GRSJ,224,A,99A,"Gender, Race, Sexuality, and Social Justice in Literature",Anika Stafford;Lori Macintosh;Marika Margaret St. Rose Yeo;Marika Yeo,76,78.25,13.261598697,93.0,3.0,,,,,5,6,5,10,20,15,9
UBCV,2018,W,GRSJ,224,A,99C,"Gender, Race, Sexuality, and Social Justice in Literature",Alice Harada Bannister;Anika Stafford;Shalimujiang Gulidana,67,84.28358209,13.128509309000002,98.0,7.0,,,,,,,,,11,21,22
UBCV,2018,W,GRSJ,224,A,001,"Gender, Race, Sexuality, and Social Justice in Literature",Christopher Benjamin Patterson;Christopher Patterson,45,77.733333333,5.507845644,90.0,66.0,,,,,,,5,14,17,,
UBCV,2018,W,GRSJ,224,A,002,"Gender, Race, Sexuality, and Social Justice in Literature",Kim Snowden,49,76.816326531,9.911427473,94.0,47.0,,,,,,6,8,13,9,5,
UBCV,2018,W,GRSJ,224,B,002,"Gender, Race, Sexuality, and Social Justice in Literature",Jessi Taylor;Kim Snowden,48,75.0,16.018606203,95.0,16.0,,,,,,6,5,5,6,8,8
UBCV,2018,W,GRSJ,224,B,101,"Gender, Race, Sexuality, and Social Justice in Literature",Jennifer Cowe,43,72.976744186,14.292003045,100.0,32.0,,,,6,,,7,,7,,6
UBCV,2018,W,GRSJ,224,C,001,"Gender, Race, Sexuality, and Social Justice in Literature",Kim Snowden,49,77.755102041,14.667893810999999,95.0,2.0,,,,,5,,,9,11,12,5
UBCV,2018,W,GRSJ,224,C,002,"Gender, Race, Sexuality, and Social Justice in Literature",Janice Stewart,46,78.760869565,12.659971533,90.0,0.0,,,,,,,,11,17,11,
UBCV,2018,W,GRSJ,230,,001,"Gender, Race, Sexuality, and Representation in Modern Asia",Christopher Benjamin Patterson;Christopher Patterson,31,79.161290323,7.307971785,89.0,50.0,,,,,,,,9,10,7,
UBCV,2018,W,GRSJ,235,,001,"Gender, Race, Sexuality, and Social Structures in Modern Asia",Christopher Benjamin Patterson;Christopher Patterson,21,70.285714286,21.947990471,86.0,0.0,,,,,,,,5,6,,
UBCV,2018,W,GRSJ,300,,99A,Intersectional Approaches to Thinking Gender,A.J. Lowik;Adrienne Lowik;Christopher Shelley,73,79.260273973,7.911010957,92.0,39.0,,,,,,,9,16,25,11,5
UBCV,2018,W,GRSJ,300,,99C,Intersectional Approaches to Thinking Gender,Anika Nicole Stafford;Anika Stafford;Se Jin Um,74,89.29729729700001,8.436271542,100.0,48.0,,,,,,,,,7,18,43
UBCV,2018,W,GRSJ,300,,901,Intersectional Approaches to Thinking Gender,Jade Pollard-Crowe;Jessi Taylor;Sunera Thobani,58,75.172413793,11.674139859,90.0,27.0,,,,,,8,7,12,12,9,
UBCV,2018,W,GRSJ,300,,902,Intersectional Approaches to Thinking Gender,Christopher Benjamin Patterson;Christopher Patterson;Sunera Thobani,23,75.217391304,17.204535664,88.0,17.0,,,,,,,,,9,,
UBCV,2018,W,GRSJ,301,,201,"Gender, Race and Indigeneity in Canada",Dorothy Nason,40,76.175,19.257882169000002,93.0,0.0,,,,,,,,9,7,11,
UBCV,2018,W,GRSJ,303,,001,"Gender, Race, Social Justice and the Law",Mark Andrew Harris;Mark Harris,46,85.369565217,3.8893512489999997,93.0,75.0,,,,,,,,,18,17,10
UBCV,2018,W,GRSJ,305,,001,Social Justice Issues in Community and International Organizing,Evangelia Chatzivasileiou;Mark Andrew Harris;Mark Harris,43,81.651162791,18.988572655,100.0,0.0,,,,,,,,,7,8,16
UBCV,2018,W,GRSJ,306,,001,"Globalization and Social Justice: Gender, Race, and Sexuality in International Politics",Mark Andrew Harris;Mark Harris,60,78.133333333,22.137066596999997,92.0,0.0,5,,,,,,,,12,33,6
UBCV,2018,W,GRSJ,307,,201,"Gender, Race, Sexuality, and Popular Culture",Janice Stewart;Wajiha Mehdi,48,84.0625,4.3633202760000005,89.0,62.0,,,,,,,,,21,25,
UBCV,2018,W,GRSJ,310,,001,"Gender, Race, Social Justice and Health",Evan Taylor,34,80.205882353,9.73210685,92.0,43.0,,,,,,,,,11,11,
UBCV,2018,W,GRSJ,311,,001,African/Black Women in the Americas,Delia Douglas,23,71.652173913,16.255373086,91.0,28.0,,,,,,,,,,,
UBCV,2018,W,GRSJ,316,,101,Queer and Trans of Colour Theorizing,John Paul Catungal,9,81.333333333,1.732050808,85.0,80.0,,,,,,,,,8,,
UBCV,2018,W,GRSJ,320,,001,Feminist Anti-Racist Pedagogies,David Ng;Evangelia Chatzivasileiou,25,78.8,22.457367017,98.0,0.0,,,,,,,,,6,7,6
UBCV,2018,W,GRSJ,325,,001,Anti-colonial and Feminist Qualitative Methodologies,Becky Ross;Kalbir Heer,46,83.695652174,17.337011872999998,98.0,0.0,,,,,,,,,,18,18
UBCV,2018,W,GRSJ,326,,001,"The Politics of Gender, Families, and Nation-Building",Becky Ross,44,76.181818182,12.16222273,95.0,27.0,,,,,,,6,8,15,,
UBCV,2018,W,GRSJ,327,,001,Theories of Representation and Difference,John Paul Catungal,47,78.255319149,6.970334921,86.0,46.0,,,,,,,6,12,21,6,
UBCV,2018,W,GRSJ,328,,004,Theories of Subjectivity,John Paul Catungal,35,75.828571429,11.996287940999999,86.0,27.0,,,,,,,8,,17,,
UBCV,2018,W,GRSJ,401,,202,"Body, Gender and Society",Kim Snowden,24,75.875,21.069888879,93.0,0.0,,,,,,,,5,5,5,
UBCV,2018,W,GRSJ,410,,201,Religious Feminism,Sarah Munawar,14,81.214285714,5.0562767,90.0,72.0,,,,,,,,,6,,
UBCV,2018,W,GRSJ,415,,201,Critical Racial and Anti-Colonial Feminist Approaches,Annette Henry,9,95.0,4.949747468,100.0,86.0,,,,,,,,,,,7
UBCV,2018,W,GRSJ,422,,101,Advanced Research Seminar,Ayesha Chaudhry;Pilar Riano-Alcala,30,85.56666666699999,2.2846313119999997,91.0,80.0,,,,,,,,,11,18,
UBCV,2018,W,GRSJ,500,,001,Intersectional Issues in Social Justice and Equality Studies,Dina Al-Kassim,10,88.9,3.510302298,93.0,85.0,,,,,,,,,,5,5
UBCV,2018,W,GRSJ,501,,002,Issues in Decolonizing and Feminist Methodologies,Becky Ross;Gillian Creese;Leonora Angeles,12,87.166666667,4.427873147,95.0,80.0,,,,,,,,,,6,
UBCV,2018,W,GRSJ,502,,001,"Issues in Gender, Sexuality, and Critical Race Theories",Denise Ferreira Da Silva,14,89.214285714,3.2386742639999997,96.0,86.0,,,,,,,,,,9,5
UBCV,2018,W,GRSJ,511,,101,Difficult Knowledge: Ethics and Praxis of Research in Challenging Settings,Erin Baines;Pilar Riano-Alcala,8,87.75,2.49284691,91.0,83.0,,,,,,,,,,5,
