Campus,Year,Session,Subject,Course,Detail,Section,Title,Professor,Reported,Avg,Median,Percentile (25),Percentile (75),High,Low,<50,50-54,55-59,60-63,64-67,68-71,72-75,76-79,80-84,85-89,90-100
UBCO,2024,S,SOCW,515,,001,Social Welfare Policy in Canada,Judy Gillespie,28,81.0,82.0,77.75,84.0,89,70,0,0,0,0,0,1,3,6,12,6,0
UBCO,2024,S,SOCW,525,,001,Human Development for Clinical Social Work,Andrea Antonishen,29,88.6,90.0,88.0,91.0,97,66,0,0,0,0,1,0,0,1,1,11,15
UBCO,2024,S,SOCW,525,,002,Human Development for Clinical Social Work,Andrea Antonishen,31,91.1,91.0,88.0,93.5,97,85,0,0,0,0,0,0,0,0,0,9,22
UBCO,2024,S,SOCW,560,,001,Braiding Indigenous Knowledge Into Clinical Practice,Laura Hockman,9,98.7,99.0,99.0,99.0,99,97,0,0,0,0,0,0,0,0,0,0,9
UBCO,2024,S,SOCW,562,,001,Cognitive Behavioral Therapy,Linda Kongnetiman,19,91.9,92.0,91.5,93.0,97,84,0,0,0,0,0,0,0,0,1,3,15
UBCO,2024,S,SOCW,563,,001,Social Work in Health Care,Donna Jansons,10,91.7,92.5,89.5,96.25,97,78,0,0,0,0,0,0,0,1,0,2,7
