Campus,Year,Session,Subject,Course,Detail,Section,Title,Professor,Reported,Avg,Median,Percentile (25),Percentile (75),High,Low,<50,50-54,55-59,60-63,64-67,68-71,72-75,76-79,80-84,85-89,90-100
UBCO,2023,W,DIHU,155,,001,Writing and Making with Technology in the Humanities,Matthew Davis,50,82.1,86.0,78.0,91.0,100.0,0.0,1,1,1,0,1,2,4,4,8,11,14
UBCO,2023,W,DIHU,155,,101,Writing and Making with Technology in the Humanities,Matthew Davis,48,83.2,84.5,81.0,88.3,94.0,57.0,0,0,2,0,0,3,1,2,14,12,10
UBCO,2023,W,DIHU,220,,101,Research with Media in the Humanities,James Phelan,43,82.4,84.0,81.0,87.0,90.0,33.0,1,0,0,0,2,0,0,4,18,15,3
UBCO,2023,W,DIHU,312,A,002,Internet Culture,Hoornaz Keshavarzian,20,78.0,79.5,73.0,87.5,91.0,42.0,1,1,0,0,2,0,2,4,1,5,4
UBCO,2023,W,DIHU,370,,001,Story and Image Across the Islamic World,Hussein Keshani,6,76.3,92.0,88.8,93.0,93.0,0.0,1,0,0,0,0,0,0,0,0,1,4
