Campus,Year,Session,Subject,Course,Detail,Section,Title,Professor,Reported,Avg,Median,Percentile (25),Percentile (75),High,Low,<50,50-54,55-59,60-63,64-67,68-71,72-75,76-79,80-84,85-89,90-100
UBCV,2025,W,ARBC,101,,001,Beginning Classical and Quranic Arabic I,Bushra Seemi Yasmin Ghazi,20,82.4,81.0,77.75,93.0,96,60,8,1,3,4,0,0,2,0,0,2,0
UBCV,2025,W,ARBC,205,,001,Beginning Classical and Quranic Arabic II,Bushra Seemi Yasmin Ghazi,10,82.2,83.0,78.25,91.5,96,51,4,0,3,2,0,0,0,0,1,0,0
UBCV,2025,W,ARBC,301,,001,Intermediate Classical and Quranic Arabic I,Bushra Seemi Yasmin Ghazi,17,83.4,86.0,74.0,90.0,98,70,5,4,1,2,3,0,0,0,0,2,0
UBCV,2025,W,ARBC,302,,001,Intermediate Classical and Quranic Arabic II,Bushra Seemi Yasmin Ghazi,9,89.2,90.0,88.0,91.0,98,81,6,1,0,2,0,0,0,0,0,0,0
UBCV,2025,W,ARBC,420,A,001,Supervised Study in Classical Arabic,Bushra Seemi Yasmin Ghazi,10,85.1,92.5,90.0,93.0,97,20,9,0,0,0,0,0,0,0,0,0,1
