Campus,Year,Session,Subject,Course,Detail,Section,Title,Professor,Reported,Avg,Median,Percentile (25),Percentile (75),High,Low,<50,50-54,55-59,60-63,64-67,68-71,72-75,76-79,80-84,85-89,90-100
UBCV,2023,S,ANTH,100,B,921,Introduction to Cultural Anthropology,David Ryniker,17,70.8,71.0,65.0,77.0,92.0,50.0,0,2,1,0,4,2,2,2,2,1,1
UBCV,2023,S,ANTH,206,,921,"Witches, Vampires, and Zombies: Anthropology of the Supernatural",Kate Kingsbury,171,72.1,74.0,67.0,79.0,93.0,0.0,8,5,3,11,17,19,33,33,25,15,2
UBCV,2023,S,ANTH,315,,922,Japanese Culture and Society,Simon Nantais,45,74.4,76.0,71.0,82.0,87.0,18.0,1,0,1,0,4,7,9,7,13,3,0
UBCV,2023,S,ANTH,403,G,921,Ethnography of Special Areas,Sabina Magliocco,11,88.7,89.0,87.0,90.5,92.0,84.0,0,0,0,0,0,0,0,0,1,5,5
UBCV,2023,S,ANTH,480,B,001,Urban Ethnographic Field School (UEFS),Patrick Moore,8,84.9,84.5,83.8,86.0,89.0,82.0,0,0,0,0,0,0,0,0,4,4,0
UBCV,2023,S,ANTH,518,A,922,Museum Methods,Jill Baird,17,89.4,90.0,86.0,92.0,95.0,80.0,0,0,0,0,0,0,0,0,1,6,10
