Campus,Year,Session,Subject,Course,Detail,Section,Title,Professor,Reported,Avg,Median,Percentile (25),Percentile (75),High,Low,<50,50-54,55-59,60-63,64-67,68-71,72-75,76-79,80-84,85-89,90-100
UBCV,2023,S,EPSE,303,,951,Teaching Highly Able Learners,Eva Leung,28,92.5,94.0,93.0,94.0,95.0,79.0,0,0,0,0,0,0,0,1,1,0,24
UBCV,2023,S,EPSE,312,,951,Introduction to the Study of Exceptional Children,Mary Heikkila,29,93.32,93.0,91.75,95.0,97.0,87.0,0,0,0,0,0,0,0,0,0,1,27
UBCV,2023,S,EPSE,320,,93Q,Classroom Inclusion of Students who are Blind and Visually Impaired,David Rathwell,34,96.59,99.0,97.25,100.0,100.0,59.0,0,0,1,0,0,0,1,0,0,0,32
UBCV,2023,S,EPSE,320,,93S,Classroom Inclusion of Students who are Blind and Visually Impaired,David Rathwell,36,97.42,98.0,97.0,99.25,100.0,88.0,0,0,0,0,0,0,0,0,0,2,34
UBCV,2023,S,EPSE,320,,93T,Classroom Inclusion of Students who are Blind and Visually Impaired,David Rathwell,36,96.83,98.0,96.75,100.0,100.0,82.0,0,0,0,0,0,0,0,0,2,1,33
UBCV,2023,S,EPSE,348,,93Q,Family-Centred Practice for Children with Special Needs,Melanie Nelson,28,91.78,95.0,90.0,98.0,99.0,69.0,0,0,0,0,0,1,2,1,1,2,20
UBCV,2023,S,EPSE,403,,93Q,Education of Students with Developmental Disabilities in Inclusive Settings,Mary Heikkila,35,93.6,95.0,90.0,96.0,98.0,89.0,0,0,0,0,0,0,0,0,0,2,33
UBCV,2023,S,EPSE,403,,93S,Education of Students with Developmental Disabilities in Inclusive Settings,Lara El Khatib,30,91.18,92.5,89.75,96.0,99.0,72.0,0,0,0,0,0,0,1,1,1,4,21
UBCV,2023,S,EPSE,406,,93Q,Typical and Atypical Development in Infants and Children,Lara El Khatib,26,89.64,90.0,86.0,93.0,97.0,77.0,0,0,0,0,0,0,0,1,1,9,14
UBCV,2023,S,EPSE,426,,93Q,Classroom Inclusion of Students Who are d/Deaf or Hard of Hearing,Bonita Squires,34,89.91,90.0,85.0,94.0,100.0,77.0,0,0,0,0,0,0,0,1,7,7,19
UBCV,2023,S,EPSE,426,,93S,Classroom Inclusion of Students Who are d/Deaf or Hard of Hearing,Alayna Finley,36,89.26,90.0,86.0,92.5,97.0,73.0,0,0,0,0,0,0,1,0,5,10,19
UBCV,2023,S,EPSE,432,,951,Classroom Management,Sunita Braich,19,92.05,93.0,90.0,96.0,99.0,69.0,0,0,0,0,0,1,0,0,1,2,15
UBCV,2023,S,EPSE,432,,952,Classroom Management,Robert Vint,36,95.4,96.0,96.0,97.0,97.0,78.0,0,0,0,0,0,0,0,1,1,0,33
UBCV,2023,S,EPSE,433,,951,Assessment and Positive Behavioural Support in School and Community Settings,Kelly Warburton,10,93.33,94.0,92.0,95.0,98.0,84.0,0,0,0,0,0,0,0,0,1,0,8
UBCV,2023,S,EPSE,436,,951,Survey of Behaviour Disorders in Children and Adolescents,Skeerat Sahota,10,90.38,91.0,89.25,91.5,94.0,86.0,0,0,0,0,0,0,0,0,0,2,6
UBCV,2023,S,EPSE,437,,951,Interventions for Children and Adolescents with Behaviour Disorders,Erin Kidd,21,92.29,93.0,90.0,95.0,98.0,81.0,0,0,0,0,0,0,0,0,1,4,16
UBCV,2023,S,EPSE,449,,93Q,Education of Students with Autism,Nadine Trottier,36,90.78,95.0,90.75,97.0,99.0,29.0,1,0,0,0,0,1,1,0,2,3,28
UBCV,2023,S,EPSE,462,,921,Human Development in Education,Suna Eryigit Madzwamuse,21,89.9,93.0,86.0,96.0,100.0,65.0,0,0,0,0,1,0,1,1,1,3,14
UBCV,2023,S,EPSE,482,,921,Introduction to Statistics for Research in Education,Cecilia Sierra Heredia,13,91.31,94.0,91.0,98.0,100.0,59.0,0,0,1,0,0,0,0,0,0,2,10
UBCV,2023,S,EPSE,483,,93S,Reading and Interpreting Research in Education,Bowen Xiao,23,89.91,90.5,88.25,92.0,96.0,70.0,0,0,0,0,0,1,0,0,0,8,13
UBCV,2023,S,EPSE,502,,941,"Cognition, Language and Literacy Processes in Education",Dianne MacDonald,7,96.43,96.0,95.0,98.0,100.0,93.0,0,0,0,0,0,0,0,0,0,0,7
UBCV,2023,S,EPSE,509,,951,Organization of Special Education Services,David Nicks,10,93.0,92.5,90.0,95.0,100.0,90.0,0,0,0,0,0,0,0,0,0,0,10
UBCV,2023,S,EPSE,511,,941,"Special Topics in Human Development, Learning, and Culture",Surita Jhangiani,12,89.92,90.0,87.5,92.0,94.0,86.0,0,0,0,0,0,0,0,0,0,4,8
UBCV,2023,S,EPSE,512,,941,Critical Issues in Special Education,Mary Heikkila,14,93.5,92.0,91.25,96.25,98.0,90.0,0,0,0,0,0,0,0,0,0,0,14
UBCV,2023,S,EPSE,516,,951,Seminar in the Development and Education of Highly Able and Creative Learners,Chih Shen Lo,9,89.0,92.0,82.75,93.5,95.0,80.0,0,0,0,0,0,0,0,0,3,0,5
UBCV,2023,S,EPSE,518,,951,Speech Development of Deaf and Hard of Hearing Students,Deirdre Curle,13,95.46,96.0,95.0,97.0,100.0,85.0,0,0,0,0,0,0,0,0,0,1,12
UBCV,2023,S,EPSE,520,,951,Curriculum Development in the Education of Deaf and Hard of Hearing Students,Alayna Finley,13,92.46,94.0,89.0,95.0,97.0,84.0,0,0,0,0,0,0,0,0,1,3,9
UBCV,2023,S,EPSE,540,,951,Seminar in Low Vision,Kim Zebehazy,20,93.26,93.0,92.0,95.0,99.0,86.0,0,0,0,0,0,0,0,0,0,2,17
UBCV,2023,S,EPSE,541,,951,Braille Reading and Writing,Cay Holbrook,20,87.79,88.0,85.0,92.5,98.0,70.0,0,0,0,0,0,1,1,0,3,5,9
UBCV,2023,S,EPSE,552,A,941,Intervention and Mental Health Promotion in Schools,Allison Cloth,7,93.5,94.0,93.25,95.5,97.0,87.0,0,0,0,0,0,0,0,0,0,1,5
UBCV,2023,S,EPSE,579,,951,Supervision and Management for Behaviour Analysts,Sarah Pastrana,17,96.25,97.5,93.0,99.0,100.0,90.0,0,0,0,0,0,0,0,0,0,0,16
UBCV,2023,S,EPSE,583,,951,Fostering Self-Regulated Learning,Deborah Butler;Simon Lisaingo,18,95.06,95.5,94.0,96.0,97.0,91.0,0,0,0,0,0,0,0,0,0,0,18
UBCV,2023,S,EPSE,588,,921,Indigenous Pathways Through Social and Emotional Learning,Johanna Sam,26,92.0,92.0,92.0,92.0,97.0,82.0,0,0,0,0,0,0,0,0,1,0,25
