Campus,Year,Session,Subject,Course,Detail,Section,Title,Professor,Reported,Avg,Median,Percentile (25),Percentile (75),High,Low,<50,50-54,55-59,60-63,64-67,68-71,72-75,76-79,80-84,85-89,90-100
UBCO,2023,S,EDUC,104,,001,Introduction to Academic Pedagogy: An Aboriginal Perspective,Denise Lecoy,15,93.47,95.0,89.0,98.0,99.0,83.0,0,0,0,0,0,0,0,0,2,3,10
UBCO,2023,S,EDUC,521,,001,Readings and Discourse in Education,Kelly Hanson,25,90.8,90.0,90.0,93.0,94.0,86.0,0,0,0,0,0,0,0,0,0,5,20
UBCO,2023,S,EDUC,524,,001,Language Teaching and Learning,Scott Douglas,20,94.5,94.5,94.0,95.25,96.0,89.0,0,0,0,0,0,0,0,0,0,1,19
UBCO,2023,S,EDUC,526,,001,Education and Diversity,Beverley Bosetti,13,88.0,88.0,88.0,90.0,92.0,82.0,0,0,0,0,0,0,0,0,1,8,4
UBCO,2023,S,EDUC,562,J,001,Special Topics in Education,Bill Cohen,8,90.38,92.5,90.0,93.0,94.0,78.0,0,0,0,0,0,0,0,1,0,0,7
UBCO,2023,S,EDUC,562,K,001,Special Topics in Education,Gabrielle Edwards,22,93.23,93.5,92.0,94.0,97.0,88.0,0,0,0,0,0,0,0,0,0,2,20
