Campus,Year,Session,Subject,Course,Detail,Section,Title,Professor,Reported,Avg,Median,Percentile (25),Percentile (75),High,Low,<50,50-54,55-59,60-63,64-67,68-71,72-75,76-79,80-84,85-89,90-100
UBCV,2025,S,SOCI,102,,801,Inequality and Social Change,Neil Armitage,27,81.5,82.0,75.0,88.5,93,70,0,0,0,0,0,3,5,3,7,2,7
UBCV,2025,S,SOCI,200,,801,Sociology of Family,Oral Robinson,46,75.5,76.0,73.0,80.0,87,52,0,1,1,2,1,5,10,13,8,5,0
UBCV,2025,S,SOCI,217,,901,Research Methods,Elic Chan,24,75.2,76.0,70.0,81.25,90,51,0,1,0,1,0,5,4,6,3,3,1
UBCV,2025,S,SOCI,224,,801,Sociology of Personal Life,Neil Armitage,27,80.4,81.0,77.0,90.0,96,16,1,0,0,0,1,1,2,5,6,3,8
UBCV,2025,S,SOCI,320,,801,Diversity in Family Forms,Alyssa Alexander,60,82.3,84.0,80.0,87.25,93,3,1,0,0,0,0,0,3,9,20,20,7
UBCV,2025,S,SOCI,380,,901,Sociological Methods: Survey Research,Elic Chan,48,77.4,83.0,77.0,87.0,91,0,5,0,0,0,0,1,3,4,12,15,8
UBCV,2025,S,SOCI,382,,801,Sociological Methods: Qualitative Research,Oral Robinson,30,76.5,81.0,73.0,85.75,91,1,1,0,1,0,1,2,5,3,8,7,2
UBCV,2025,S,SOCI,415,A,801,Theories of Family and Kinship,Alyssa Alexander,34,83.4,84.0,80.25,87.75,93,64,0,0,0,0,1,1,0,5,12,10,5
UBCV,2025,S,SOCI,480,A,701,Urban Ethnographic Field School (UEFS),,22,82.1,85.0,80.0,87.0,92,51,0,1,0,0,0,1,1,2,5,10,2
