Campus,Year,Session,Subject,Course,Detail,Section,Title,Professor,Reported,Avg,Median,Percentile (25),Percentile (75),High,Low,<50,50-54,55-59,60-63,64-67,68-71,72-75,76-79,80-84,85-89,90-100
UBCV,2025,S,COMR,329,,921,Principles of Organizational Behaviour,Amy Stanley,34,74.8,77.0,73.0,78.0,85,28,0,1,15,6,7,0,0,1,0,3,1
UBCV,2025,S,COMR,398,,921,Introduction to Business Processes and Operations,Mahesh Nagarajan; Tim Huh,45,76.3,76.0,72.0,82.0,95,50,7,4,8,6,11,2,1,4,1,1,0
UBCV,2025,S,COMR,457,,971,Fundamentals of Financial Accounting,Scott Sinclair,38,75.0,77.0,66.5,84.75,93,46,5,5,4,6,4,2,1,3,1,4,3
UBCV,2025,S,COMR,465,,921,Marketing Management,Phaedra Burke,28,75.8,78.0,72.5,80.75,88,52,0,3,8,6,4,1,0,2,1,3,0
UBCV,2025,S,COMR,473,,971,Business Finance,Caren Lombard,32,80.0,82.0,74.25,86.5,97,52,6,5,2,8,5,0,2,0,1,3,0
UBCV,2025,S,COMR,493,,971,Strategic Management in Business,Adam Pankratz,21,73.8,74.0,71.0,76.0,80,68,0,0,5,1,9,0,0,0,0,6,0
