Campus,Year,Session,Subject,Course,Detail,Section,Title,Professor,Reported,Avg,Median,Percentile (25),Percentile (75),High,Low,<50,50-54,55-59,60-63,64-67,68-71,72-75,76-79,80-84,85-89,90-100
UBCV,2023,W,AFST,250,A,101,Introduction to African Studies,Justice Gbolonyo,33,80.13,82.0,76.5,85.25,95.0,51.0,0,1,0,0,3,1,3,4,10,5,5
UBCV,2023,W,AFST,250,A,102,Introduction to African Studies,Justice Gbolonyo,22,80.94,80.0,74.5,86.75,95.0,70.0,0,0,0,0,0,2,3,3,2,5,3
UBCV,2023,W,AFST,250,A,201,Introduction to African Studies,Justice Gbolonyo,30,82.3,83.5,79.5,87.75,94.0,51.0,0,1,0,0,2,0,0,5,10,5,7
UBCV,2023,W,AFST,308,,201,The Languages of Africa,Joash Gambarage,24,77.96,76.0,73.25,84.0,93.0,63.0,0,0,0,1,3,2,2,5,6,3,2
UBCV,2023,W,AFST,313,,201,Africa from Imperialism to Independence,David Morton,10,63.7,70.0,59.0,76.0,92.0,0.0,1,1,1,0,1,1,1,2,1,0,1
UBCV,2023,W,AFST,350,,101,Topics in African Studies,Joash Gambarage,23,80.14,84.0,79.0,87.0,95.0,52.0,0,1,0,2,0,1,0,3,6,4,4
UBCV,2023,W,AFST,370,A,201,Literatures and Cultures of Africa and/or the Middle East,Suzanne James,14,75.15,76.0,76.0,80.0,83.0,54.0,0,1,0,0,0,1,1,6,4,0,0
UBCV,2023,W,AFST,450,R,201,African Diasporic Culture in African Canadian Communities,Calisto Mudzingwa,17,91.88,93.0,91.75,93.0,94.0,83.0,0,0,0,0,0,0,0,0,1,1,14
