Campus,Year,Session,Subject,Course,Detail,Section,Title,Professor,Reported,Avg,Median,Percentile (25),Percentile (75),High,Low,<50,50-54,55-59,60-63,64-67,68-71,72-75,76-79,80-84,85-89,90-100
UBCV,2023,W,CSIS,200,,101,Critical Engagements in Sexuality Studies,Isabel MacHado,33,88.79,91.0,83.0,94.0,99.0,69.0,0,0,0,0,0,2,1,1,5,4,20
UBCV,2023,W,CSIS,300,A,102,Introduction to Critical Studies in Sexuality,Isabel MacHado,73,89.61,92.0,88.0,95.0,99.0,21.0,1,0,0,0,1,0,0,3,1,15,43
UBCV,2023,W,CSIS,301,,201,Introduction to Trans* Studies,Isabel MacHado,18,87.29,89.0,88.0,94.0,97.0,67.0,0,0,0,0,1,1,1,1,0,5,8
UBCV,2023,W,CSIS,450,B,201,Topics in Critical Studies in Sexuality,Isabel MacHado,21,83.44,88.5,83.25,95.0,98.0,2.0,1,0,0,1,0,0,0,1,3,5,7
UBCV,2023,W,CSIS,500,C,201,Critical Studies in Sexuality: Multi-disciplinary Approaches,Isabel MacHado,9,92.22,95.0,93.0,95.0,96.0,75.0,0,0,0,0,0,0,1,0,0,0,8
