Campus,Year,Session,Subject,Course,Detail,Section,Title,Professor,Enrolled,Avg,Std dev,High,Low,<50,50-54,55-59,60-63,64-67,68-71,72-75,76-79,80-84,85-89,90-100
UBCV,2014,W,EPSE,271,,D03,Teaching Adolescents with Special Learning Needs,Elizabeth Jordan,85,48.270588235,30.695271947,93.0,0.0,31,7,5,,7,8,7,7,,,
UBCV,2014,W,EPSE,303,,63A,Teaching Highly Able Learners,Chih Shen Lo,18,93.555555556,4.017933654,99.0,82.0,,,,,,,,,,,16
UBCV,2014,W,EPSE,303,,63B,Teaching Highly Able Learners,,19,91.36842105299999,6.49110953,99.0,75.0,,,,,,,,,,,13
UBCV,2014,W,EPSE,312,,074,Introduction to the Study of Exceptional Children,Elizabeth Jordan,32,89.59375,4.00692445,97.0,81.0,,,,,,,,,,10,18
UBCV,2014,W,EPSE,312,,075,Introduction to the Study of Exceptional Children,Janet Ruth Jamieson,36,91.666666667,3.942443042,97.0,80.0,,,,,,,,,,8,26
UBCV,2014,W,EPSE,316,,074,Learning Disabilities,Mary Heikkila,31,91.290322581,2.54549993,96.0,86.0,,,,,,,,,,8,23
UBCV,2014,W,EPSE,316,,075,Learning Disabilities,Nancy Perry;Silvia Mazabel Ortega,34,87.67647058799999,8.223103404,99.0,63.0,,,,,,,,,,9,17
UBCV,2014,W,EPSE,320,,074,Classroom Inclusion of Students who are Blind and Visually Impaired,David Rathwell,35,92.485714286,6.237323279,100.0,77.0,,,,,,,,,,,27
UBCV,2014,W,EPSE,320,,075,Classroom Inclusion of Students who are Blind and Visually Impaired,David Rathwell,35,93.685714286,5.83988028,100.0,82.0,,,,,,,,,,6,26
UBCV,2014,W,EPSE,348,,63A,Family-Centred Practice for Children with Special Needs,Elizabeth Cox,32,78.15625,7.96001854,93.0,63.0,,,,,,,5,5,9,,
UBCV,2014,W,EPSE,348,,63C,Family-Centred Practice for Children with Special Needs,Elizabeth Cox,20,79.85,9.126450858,91.0,62.0,,,,,,,,,,,
UBCV,2014,W,EPSE,390,A,63C,Special Topics,David Nicks,23,83.260869565,20.354176233,100.0,0.0,,,,,,,,,,7,8
UBCV,2014,W,EPSE,403,,63A,Education of Students with Developmental Disabilities in Inclusive Settings,Diana L Wilk;Diana Wilk,41,87.756097561,14.86906266,97.0,0.0,,,,,,,,,,8,26
UBCV,2014,W,EPSE,403,,63C,Education of Students with Developmental Disabilities in Inclusive Settings,,41,89.731707317,5.54988464,99.0,70.0,,,,,,,,,5,14,21
UBCV,2014,W,EPSE,406,,63A,Typical and Atypical Development in Infants and Children,Lara El Khatib,59,90.93220339,13.418803594000002,100.0,0.0,,,,,,,,,,11,41
UBCV,2014,W,EPSE,406,,63C,Typical and Atypical Development in Infants and Children,Lara El Khatib,59,93.0,5.708432963,99.0,71.0,,,,,,,,,,8,46
UBCV,2014,W,EPSE,408,,63C,Educational Programming for Highly Able Learners,Hyekyung Lee,15,89.0,3.835920452,93.0,81.0,,,,,,,,,,5,8
UBCV,2014,W,EPSE,408,,63D,Educational Programming for Highly Able Learners,Hyekyung Lee,13,90.846153846,4.947156656000001,99.0,83.0,,,,,,,,,,5,7
UBCV,2014,W,EPSE,411,,074,Augmentative and Alternative Communication for Individuals with Severe Speech and/or Physical Impairments,Tammy Mceachern Hughes,11,82.818181818,27.542033991,94.0,0.0,,,,,,,,,,,7
UBCV,2014,W,EPSE,421,,073,Assessment of Learning Difficulties,Sharon Malone,21,90.095238095,5.512755771,97.0,77.0,,,,,,,,,,5,13
UBCV,2014,W,EPSE,421,,074,Assessment of Learning Difficulties,Serge Lacroix,16,88.8125,3.54436172,94.0,82.0,,,,,,,,,,6,7
UBCV,2014,W,EPSE,431,,074,Programming for Children with Specific Learning Disabilities,Kimberley Macneil;Nancy Perry,19,89.736842105,5.404135302,97.0,74.0,,,,,,,,,,5,12
UBCV,2014,W,EPSE,431,,075,Programming for Children with Specific Learning Disabilities,Nicole Fusaro;Nicole Marie Fusaro,16,90.375,7.320063752,98.0,78.0,,,,,,,,,,,11
UBCV,2014,W,EPSE,432,,63C,Classroom Management,Pauline Both;Ruth Ervin,25,94.88,3.5510561810000003,100.0,86.0,,,,,,,,,,,24
UBCV,2014,W,EPSE,436,,074,Survey of Behaviour Disorders in Children and Adolescents,Kathleen Champion,33,92.121212121,4.181488788,98.0,83.0,,,,,,,,,,,26
UBCV,2014,W,EPSE,437,,074,Interventions for Children and Adolescents with Behaviour Disorders,Aaron White,23,93.869565217,1.984126733,97.0,90.0,,,,,,,,,,,23
UBCV,2014,W,EPSE,449,,63A,Education of Students with Autism,Lara El Khatib,60,90.25,5.319057518,98.0,75.0,,,,,,,,,6,10,41
UBCV,2014,W,EPSE,449,,63C,Education of Students with Autism,Lara El Khatib,61,90.62295082,6.398343365,100.0,66.0,,,,,,,,,5,14,39
UBCV,2014,W,EPSE,449,,074,Education of Students with Autism,Laura Grow,25,98.8,1.224744871,100.0,94.0,,,,,,,,,,,25
UBCV,2014,W,EPSE,481,,074,Introduction to Research in Education,Hillel Goelman,11,87.454545455,3.724611023,90.0,80.0,,,,,,,,,,,6
UBCV,2014,W,EPSE,482,,074,Introduction to Statistics for Research in Education,Shayna Rusticus,20,86.9,6.2819708610000005,98.0,73.0,,,,,,,,,,8,7
UBCV,2014,W,EPSE,482,,075,Introduction to Statistics for Research in Education,Shayna Rusticus,13,91.615384615,5.708742732999999,97.0,74.0,,,,,,,,,,,12
UBCV,2014,W,EPSE,501,,074,"Seminar in Human Development, Learning and Culture",Lina Darwich,19,89.57894736799999,2.9873025639999997,96.0,85.0,,,,,,,,,,11,8
UBCV,2014,W,EPSE,503,,075,"Cultural Perspectives on Learning, Development and Media",Jennifer Vadeboncoeur,18,87.888888889,3.6604224910000003,94.0,82.0,,,,,,,,,5,7,6
UBCV,2014,W,EPSE,505,,075,Foundations in Human Development: Infancy to Adulthood,Shelley Hymel,21,85.95238095200001,5.61672672,96.0,78.0,,,,,,,,,9,5,5
UBCV,2014,W,EPSE,507,,074,Applied Child and Adolescent Psychopathology,Tigerson Young,12,87.5,2.195035721,90.0,84.0,,,,,,,,,,8,
UBCV,2014,W,EPSE,512,,63C,Critical Issues in Special Education,Kathleen Champion,17,92.411764706,3.083399575,100.0,85.0,,,,,,,,,,,16
UBCV,2014,W,EPSE,512,,074,Critical Issues in Special Education,Elizabeth Jordan,19,91.210526316,3.823595565,95.0,83.0,,,,,,,,,,,15
UBCV,2014,W,EPSE,526,,074,Seminar in Specific Learning Disabilities,Sterett Mercer,11,89.0,5.531726674,99.0,81.0,,,,,,,,,,,7
UBCV,2014,W,EPSE,528,,074,Basic Principles of Measurement,Anita Hubley,9,88.333333333,4.974937186,96.0,80.0,,,,,,,,,,,
UBCV,2014,W,EPSE,528,,075,Basic Principles of Measurement,Anita Hubley,18,84.555555556,9.506791518,96.0,63.0,,,,,,,,,,,7
UBCV,2014,W,EPSE,531,,090,Curriculum-Based Assessment and Intervention,Sterett Mercer,13,92.923076923,6.409128106,99.0,77.0,,,,,,,,,,,11
UBCV,2014,W,EPSE,534,,075,Academic Assessment in Schools,Rachel Weber,11,93.636363636,2.01359019,96.0,90.0,,,,,,,,,,,11
UBCV,2014,W,EPSE,535,,074,Social and Emotional Assessment in Schools,Rachel Weber,13,92.846153846,4.793157516,99.0,81.0,,,,,,,,,,,11
UBCV,2014,W,EPSE,537,,62A,Programming in Orientation and Mobility,Kim Zebehazy,6,84.5,9.439279634,96.0,72.0,,,,,,,,,,,
UBCV,2014,W,EPSE,543,,074,Working with Students with Visual Impairments: Elementary and Secondary Curriculum,Cay Holbrook,8,93.25,2.434865793,96.0,89.0,,,,,,,,,,,7
UBCV,2014,W,EPSE,544,,074,Literacy Instruction for Students who are Visually Impaired,Cay Holbrook,7,93.714285714,4.608480795,98.0,84.0,,,,,,,,,,,6
UBCV,2014,W,EPSE,549,,074,Seminar in Autism,Pat Mirenda,18,87.22222222200001,6.752390039,98.0,72.0,,,,,,,,,,7,7
UBCV,2014,W,EPSE,550,,074,"Professional, Ethical and Legal Issues in School Psychology",Serge Lacroix,7,88.714285714,3.0394235039999997,94.0,85.0,,,,,,,,,,,
UBCV,2014,W,EPSE,551,A,074,School-based Consultation,Allison Cloth,7,93.285714286,2.497617913,95.0,88.0,,,,,,,,,,,6
UBCV,2014,W,EPSE,552,A,074,School-Based Interventions,Suretha Swart,21,91.523809524,1.435933411,94.0,90.0,,,,,,,,,,,21
UBCV,2014,W,EPSE,553,,074,Theories of Cognitive Assessment,Laurie Ford,18,92.388888889,3.927862596,98.0,85.0,,,,,,,,,,,14
UBCV,2014,W,EPSE,554,,075,Practicum in Cognitive Assessment,Laurie Ford,11,93.090909091,4.323298404,97.0,81.0,,,,,,,,,,,10
UBCV,2014,W,EPSE,561,F,074,Laboratory Practicum,Jessica J Trach;Jessica Trach;Serge Lacroix,7,88.428571429,2.572750983,91.0,85.0,,,,,,,,,,,
UBCV,2014,W,EPSE,561,H,074,Laboratory Practicum,Lina Darwich,6,91.666666667,2.065591118,94.0,88.0,,,,,,,,,,,5
UBCV,2014,W,EPSE,565,R,62R,Special Course in Subject Matter Field,Deborah Butler,19,90.684210526,2.187150139,95.0,87.0,,,,,,,,,,6,13
UBCV,2014,W,EPSE,568,,075,Applied Developmental Neuropsychology,Rachel Weber,7,93.714285714,2.138089935,97.0,90.0,,,,,,,,,,,7
UBCV,2014,W,EPSE,574,,074,Principles of Behaviour Analysis,Laura Grow,21,93.80952381,2.619523766,97.0,87.0,,,,,,,,,,,20
UBCV,2014,W,EPSE,575,,074,Seminar in Instructional Methods for Persons with Significant Learning Challenges,Pat Mirenda,18,87.611111111,9.381702397,97.0,61.0,,,,,,,,,,,11
UBCV,2014,W,EPSE,576,,074,Assessment and Positive Behaviour Support in School and Community Settings,Pat Mirenda,19,87.210526316,4.82561392,95.0,76.0,,,,,,,,,,10,5
UBCV,2014,W,EPSE,577,,075,Seminar in Assessment and Positive Behaviour Support in School and Community Settings,Joseph Lucyshyn,19,85.05263157899999,5.049462944,93.0,77.0,,,,,,,,,6,6,5
UBCV,2014,W,EPSE,580,A,075,Investigation and Report of a Problem in Education,,8,94.125,2.748376144,98.0,90.0,,,,,,,,,,,8
UBCV,2014,W,EPSE,581,A,075,"Special Topics in Measurement, Evaluation, and Research Methodology",Anne Gadermann,5,90.8,3.492849839,95.0,87.0,,,,,,,,,,,
UBCV,2014,W,EPSE,584,,074,Motivation in Education,Shelley Hymel,18,85.277777778,5.366624041000001,94.0,70.0,,,,,,,,,6,8,
UBCV,2014,W,EPSE,585,,61R,Social and Emotional Development in Education,Kimberly Schonert-Reichl,20,93.35,3.950682819,99.0,85.0,,,,,,,,,,,16
UBCV,2014,W,EPSE,591,,075,Theory and Practice of Program Evaluation,Sandra Mathison,13,89.30769230799999,5.186273797,97.0,80.0,,,,,,,,,,,8
UBCV,2014,W,EPSE,592,,074,Experimental Designs and Analysis in Educational Research,Amery Wu,17,94.235294118,2.65822807,98.0,89.0,,,,,,,,,,,16
UBCV,2014,W,EPSE,592,,075,Experimental Designs and Analysis in Educational Research,Bruno Zumbo,19,93.684210526,4.607392991,98.0,81.0,,,,,,,,,,,15
UBCV,2014,W,EPSE,592,,090,Experimental Designs and Analysis in Educational Research,Amery Wu,18,95.444444444,4.655448702,99.0,79.0,,,,,,,,,,,17
UBCV,2014,W,EPSE,593,,074,Design and Analysis of Research with Small Samples and Single Subjects,Joseph Lucyshyn,17,86.11764705899999,5.797438582000001,94.0,77.0,,,,,,,,,,5,6
UBCV,2014,W,EPSE,595,,074,Qualitative Research Methods,Sandra Mathison,15,86.26666666700001,5.338093113999999,98.0,78.0,,,,,,,,,6,6,
UBCV,2014,W,EPSE,595,,075,Qualitative Research Methods,Sandra Mathison,15,84.2,10.421132376000001,100.0,60.0,,,,,,,,,5,,5
UBCV,2014,W,EPSE,596,,074,Correlational Designs and Analysis in Educational Research,Amery Wu,10,92.7,1.8885620630000002,97.0,90.0,,,,,,,,,,,10
UBCV,2014,W,EPSE,596,,090,Correlational Designs and Analysis in Educational Research,Amery Wu,16,93.6875,2.242580359,97.0,89.0,,,,,,,,,,,15
UBCV,2014,W,EPSE,597,,074,Structural Equation Modeling and Factor Analysis,Bruno Zumbo,12,92.916666667,1.831955405,96.0,90.0,,,,,,,,,,,12
UBCV,2014,W,EPSE,604,A,075,"Advanced Topics in Human Development, Learning, and Culture",Nancy Perry,8,93.625,2.7222627139999998,97.0,90.0,,,,,,,,,,,8
UBCV,2014,W,EPSE,606,,075,College and University Teaching,Jennifer Vadeboncoeur,13,93.23076923100001,2.087815691,96.0,88.0,,,,,,,,,,,12
UBCV,2014,W,EPSE,632,,075,Systems Change in Schools,Allison Cloth,7,93.85714285700001,2.035400978,96.0,91.0,,,,,,,,,,,7
UBCV,2014,W,EPSE,681,B,074,"Advanced Topics in Measurement, Evaluation, and Research",Sandra Mathison,7,95.85714285700001,1.463850109,98.0,95.0,,,,,,,,,,,7
