Campus,Year,Session,Subject,Course,Detail,Section,Title,Professor,Reported,Avg,Median,Percentile (25),Percentile (75),High,Low,<50,50-54,55-59,60-63,64-67,68-71,72-75,76-79,80-84,85-89,90-100
UBCV,2022,W,ACAM,250,,002,Asian Canadians in Popular Culture,Mila Zuo,50,77.3,80.0,76.0,83.8,92.0,32.0,3,1,0,0,1,4,2,11,16,9,3
UBCV,2022,W,ACAM,300,,001,Dis/Orienting Asian Canada,Laura Ishiguro,48,79.5,83.0,77.8,86.3,94.0,19.0,2,0,0,1,1,3,2,6,15,12,6
UBCV,2022,W,ACAM,320,B,001,Selected Topics in ACAM Studies,Benjamin Cheung,57,85.8,86.0,84.0,89.0,95.0,72.0,0,0,0,0,0,0,3,4,10,26,14
UBCV,2022,W,ACAM,320,C,001,Selected Topics in ACAM Studies,Christopher Lee,15,81.1,83.0,78.0,85.5,86.0,70.0,0,0,0,0,0,1,2,3,2,7,0
UBCV,2022,W,ACAM,350,,001,Asian Canadian Community-Based Media,Alejandro Yoshizawa,16,86.1,85.0,84.0,89.3,92.0,80.0,0,0,0,0,0,0,0,0,7,5,4
