Campus,Year,Session,Subject,Course,Detail,Section,Title,Professor,Reported,Avg,Median,Percentile (25),Percentile (75),High,Low,<50,50-54,55-59,60-63,64-67,68-71,72-75,76-79,80-84,85-89,90-100
UBCV,2022,W,SCAN,332,A,001,Topics in Scandinavian Studies (in English),Tim Frandy,6,81.0,80.0,74.5,87.8,91.0,72.0,0,0,0,0,0,0,2,1,1,1,1
UBCV,2022,W,SCAN,334,,001,Contemporary Scandinavian Fiction (in English),Ann-Kathrine Havemose,23,80.3,82.0,76.5,84.5,92.0,57.0,0,0,1,0,0,1,2,6,7,3,3
UBCV,2022,W,SCAN,335,,001,Vikings and Norse Mythology (in English),Geoffrey Winthrop-Young,163,77.0,79.0,72.0,85.0,97.0,4.0,2,3,5,4,9,16,25,27,27,30,15
UBCV,2022,W,SCAN,336,,001,Scandinavian Crime Fiction (in English),Lena Karlstrom,43,82.2,83.0,80.0,85.0,92.0,72.0,0,0,0,0,0,0,3,7,16,15,2
UBCV,2022,W,SCAN,411,A,001,Scandinavian Drama and Film in Translation,Kyle Frackman,24,85.5,87.5,79.0,91.0,94.0,72.0,0,0,0,0,0,0,2,5,2,5,10
UBCV,2022,W,SCAN,414,,001,Topics in Danish and Northern European Cultural Studies (in English).,Ann-Kathrine Havemose,19,77.8,78.0,75.5,85.0,91.0,50.0,0,1,0,1,1,0,2,5,3,5,1
