Campus,Year,Session,Subject,Course,Detail,Section,Title,Professor,Reported,Avg,Median,Percentile (25),Percentile (75),High,Low,<50,50-54,55-59,60-63,64-67,68-71,72-75,76-79,80-84,85-89,90-100
UBCV,2022,W,FNEL,101,,001,Introduction to a Salish Language I,Fiona Campbell;Larry Grant,24,84.2,86.5,78.0,93.3,99.0,53.0,0,1,1,0,0,1,2,2,4,3,10
UBCV,2022,W,FNEL,102,,001,Introduction to a Salish Language II,Fiona Campbell;Larry Grant,17,84.9,86.0,81.0,97.0,100.0,50.0,0,1,0,0,1,1,0,1,3,3,7
UBCV,2022,W,FNEL,180,,001,Introduction to Endangered Language Documentation and Revitalization,Candace Galla,27,88.4,87.0,86.0,91.0,100.0,81.0,0,0,0,0,0,0,0,0,5,11,11
UBCV,2022,W,FNEL,282,,001,Structures of Endangered Languages: Conservation and Revitalization,Daisy Rosenblum,14,81.5,85.5,73.8,96.0,99.0,50.0,0,2,0,1,0,0,1,2,1,1,6
UBCV,2022,W,FNEL,380,,001,Technologies for Endangered Language Documentation and Revitalization,Aynur Kadir,13,84.2,84.0,80.0,86.0,93.0,76.0,0,0,0,0,0,0,0,3,4,4,2
UBCV,2022,W,FNEL,381,,002,"Biocultural Diversity: Language, Community, and Environment",Pasang Sherpa,17,90.4,94.0,86.0,98.0,100.0,53.0,0,1,0,0,0,0,0,0,2,3,11
